{
  "schema_version": "lnv.collector.dataset.v1",
  "collector": {
    "tech_id": "Lenovo.DE",
    "module": "LNV.AsBuiltDoc.Lenovo.DE",
    "entry_point": "Invoke-LnvAsBuiltDoc.Lenovo.DE"
  },
  "source": {
    "bundle_id": "target_de-prod-01",
    "bundle_root": "C:\\Github\\LNV.AsBuiltDoc.Core\\out\\b0c8360d-800e-4cab-a84f-d1bc53c8646f\\datasets\\Lenovo.DE\\collector-out\\de-prod-01\\target_de-prod-01",
    "file": "system_1_DE4200_Rack4/alerts.json"
  },
  "dataset": {
    "key": "alerts",
    "schema_path": "tech/Lenovo.DE/dataset/alerts.schema.json"
  },
  "item_count": 2,
  "items": [
    {
      "rowKey": "1|AutoSupport|https://support.netapp.com/put/AsupPut/",
      "systemId": "1",
      "mechanism": "AutoSupport",
      "enabled": true,
      "destination": "https://support.netapp.com/put/AsupPut/",
      "severityProfile": null,
      "routingType": "direct",
      "authRequired": null,
      "notes": "https"
    },
    {
      "rowKey": "1|Email|test@internal.lab",
      "systemId": "1",
      "mechanism": "Email",
      "enabled": true,
      "destination": "test@internal.lab",
      "severityProfile": "",
      "routingType": "",
      "authRequired": null,
      "notes": "mail.internal.lab; none"
    }
  ]
}
